[
  {
    "id": "poi-seoul-001",
    "name": "링크아트 노월 전시",
    "category": "exhibition",
    "description": "한남동 앵커 다이닝과 연계된 몰입형 미디어 아트 전시",
    "address": "서울 용산구 한남대로20길 45",
    "lat": 37.534946,
    "lng": 127.000832,
    "openHours": "10:00-21:00",
    "closedDays": ["월"],
    "isFree": false,
    "isPaid": true,
    "reservable": true,
    "reservationType": "TICKETING",
    "endDate": "2026-02-14",
    "durationMinutes": 70,
    "tags": ["media-art", "immersive"],
    "sessions": [
      { "time": "11:00", "capacity": 40, "status": "available", "price": 18000 },
      { "time": "13:00", "capacity": 40, "status": "available", "price": 18000 },
      { "time": "15:00", "capacity": 40, "status": "soldOut", "price": 18000 }
    ],
    "entryMethod": "QR",
    "images": ["https://static.catchtable.app/images/poi/poi-seoul-001/main.jpg"],
    "dataSource": "partner"
  },
  {
    "id": "poi-seoul-002",
    "name": "석파정 현대미술관 소장전",
    "category": "gallery",
    "description": "안국동 fine dining 동선에서 이동 가능한 전통 한옥 미술관",
    "address": "서울 종로구 창덕궁1길 35-1",
    "lat": 37.57894,
    "lng": 126.986727,
    "openHours": "11:00-20:00",
    "closedDays": [],
    "isFree": false,
    "isPaid": true,
    "reservable": true,
    "reservationType": "FREE_RESERVATION",
    "durationMinutes": 60,
    "tags": ["gallery", "hanok"],
    "entryMethod": "reservationCode",
    "images": ["https://static.catchtable.app/images/poi/poi-seoul-002/main.jpg"],
    "dataSource": "public"
  },
  {
    "id": "poi-seoul-003",
    "name": "성수 캔버스 메종 팝업",
    "category": "popup",
    "description": "파인다이닝 예약 후 이동 가능한 F&B 콜라보 굿즈 스토어",
    "address": "서울 성동구 연무장17길 10",
    "lat": 37.544804,
    "lng": 127.056245,
    "openHours": "12:00-22:00",
    "closedDays": ["화"],
    "isFree": true,
    "isPaid": false,
    "reservable": false,
    "reservationType": "NONE",
    "endDate": "2025-12-31",
    "tags": ["popup", "goods"],
    "images": ["https://static.catchtable.app/images/poi/poi-seoul-003/main.jpg"],
    "dataSource": "manual"
  },
  {
    "id": "poi-seoul-004",
    "name": "남산 루프탑 재즈 공연",
    "category": "performance",
    "description": "용산·이태원 fine dining 코스 이후 즐길 수 있는 저녁 야외 재즈",
    "address": "서울 용산구 신흥로20길 33",
    "lat": 37.545321,
    "lng": 126.99438,
    "openHours": "18:00-23:00",
    "closedDays": ["월", "화"],
    "isFree": false,
    "isPaid": true,
    "reservable": true,
    "reservationType": "TICKETING",
    "tags": ["live", "night"],
    "sessions": [
      { "time": "19:00", "capacity": 120, "status": "available", "price": 45000 },
      { "time": "21:30", "capacity": 120, "status": "available", "price": 45000 }
    ],
    "entryMethod": "QR",
    "images": ["https://static.catchtable.app/images/poi/poi-seoul-004/main.jpg"],
    "dataSource": "partner"
  },
  {
    "id": "poi-seoul-005",
    "name": "북촌 스토리 워크 투어",
    "category": "walk",
    "description": "삼청·북촌 다이닝 손님을 위한 90분 도보 인문학 투어",
    "address": "서울 종로구 계동길 11",
    "lat": 37.583725,
    "lng": 126.985967,
    "openHours": "10:00-18:00",
    "closedDays": ["월"],
    "isFree": false,
    "isPaid": true,
    "reservable": true,
    "reservationType": "FREE_RESERVATION",
    "durationMinutes": 90,
    "tags": ["tour", "storytelling"],
    "sessions": [
      { "time": "10:30", "capacity": 15, "status": "available", "price": 25000 },
      { "time": "14:00", "capacity": 15, "status": "closed", "price": 25000 }
    ],
    "entryMethod": "reservationCode",
    "images": ["https://static.catchtable.app/images/poi/poi-seoul-005/main.jpg"],
    "dataSource": "manual"
  }
]
